{
  "$schema": "../../../../../docs/design/conveyor.schema.json",
  "formatVersion": 2,
  "id": "bean_42",
  "rows": 42,
  "width": 4,
  "pickRows": 5,
  "scale": 0.45,
  "loop": { "nodes": [
    { "x": 0.75, "z": 3.1, "yRotation": 270 },
    { "x": -0.75, "z": 3.1, "yRotation": 270 },
    { "x": -1.55, "z": 3.9, "yRotation": 0 },
    { "x": -1.55, "z": 4.45, "yRotation": 0 },
    { "x": -0.95, "z": 5.2, "yRotation": 90 },
    { "x": 0, "z": 4.75, "yRotation": 90 },
    { "x": 0.95, "z": 5.2, "yRotation": 90 },
    { "x": 1.55, "z": 4.45, "yRotation": 180 },
    { "x": 1.55, "z": 3.9, "yRotation": 180 }
  ] },
  "feeders": [
    { "side": "right", "mergeAt": 34, "nodes": [
      { "x": 2.4, "z": 11.7, "yRotation": 180 },
      { "x": 2.4, "z": 8.4, "yRotation": 180 },
      { "x": 2.4, "z": 6.3, "yRotation": 180 },
      { "x": 1.821, "z": 4.992, "yRotation": 245.8 }
    ] },
    { "side": "left", "mergeAt": 13, "nodes": [
      { "x": -2.4, "z": 11.7, "yRotation": 180 },
      { "x": -2.4, "z": 8.4, "yRotation": 180 },
      { "x": -2.4, "z": 6.3, "yRotation": 180 },
      { "x": -1.887, "z": 4.907, "yRotation": 111.7 }
    ] },
    { "side": "middle", "mergeAt": 23, "nodes": [
      { "x": -0.055, "z": 11.7, "yRotation": 180 },
      { "x": -0.055, "z": 8.4, "yRotation": 180 },
      { "x": 0.398, "z": 5.468, "yRotation": 152.7 }
    ] }
  ],
  "meta": { "name": "Bean" }
}
